{
  "$schema": "https://json-schema.org/draft/2020-12/schema",
  "$id": "https://raw.githubusercontent.com/salus-ryan/agi-format/main/schemas/goal-loop-v0.1.0.json",
  "title": ".agi goal loop v0.1.0",
  "type": "object",
  "required": ["name", "description", "loop", "steps"],
  "properties": {
    "name": {"type": "string", "minLength": 1},
    "description": {"type": "string"},
    "loop": {"type": "string", "minLength": 1},
    "steps": {"type": "array", "minItems": 1, "items": {"$ref": "#/$defs/step"}}
  },
  "$defs": {
    "step": {
      "type": "object",
      "required": ["name"],
      "properties": {
        "name": {"type": "string", "minLength": 1},
        "module": {"type": "string"},
        "call": {"type": "string"},
        "inputs": {"type": "array", "items": {"type": "string"}},
        "outputs": {"type": "array", "items": {"type": "string"}},
        "description": {"type": "string"},
        "condition": {"type": "string"},
        "requires": {"type": "string"},
        "on_reject": {"type": ["string", "object"]},
        "on_true": {"type": ["string", "object"]},
        "loop": {"type": "string"},
        "over": {"type": "string"},
        "steps": {"type": "array", "items": {"$ref": "#/$defs/step"}}
      }
    }
  }
}
